timestamp,numberOfRecipients,numberOfCCs,numberOfBCCs,recipientType,lengthOfThread,responseTime,titleContent,messageContent,recipientRoleLevel,employeeID
2024-11-09 08:15:23,2,1,0,internal,1,0,"Kickoff Meeting Reminder","Just a reminder that our project kickoff meeting will start in 15 minutes. Please make sure to join on time and have your materials ready.",mid-level,E001
2024-11-09 09:05:45,1,0,0,external,1,0,"Follow-up on Contract","Hi Anna, I just wanted to follow up on the contract we discussed yesterday. Can you confirm if it's been signed?",manager,E005
2024-11-09 09:12:10,3,1,0,internal,3,7,"Urgent: System Outage","We are experiencing a system outage affecting the internal CRM. The tech team is looking into it. Please refrain from making any changes until further notice.",senior,E002
2024-11-09 09:30:47,5,0,2,external,2,18,"Upcoming Workshop Details","Dear team, Attached you will find the agenda for next week's workshop. Please review the document and provide your feedback by the end of the week.",junior,E007
2024-11-09 10:22:19,1,0,0,internal,2,52,"Project Status Update","The client has requested additional features for the software. Let's discuss how we can incorporate these into the timeline without causing delays.",mid-level,E004
2024-11-09 10:45:33,4,2,0,internal,1,0,"Team Lunch Today","Just a reminder, we're having a team lunch at 12:30 PM in the cafeteria. See you all there!",junior,E009
2024-11-09 11:01:58,2,0,0,external,1,0,"Feedback on Design Mockups","Hi Mikael, The design mockups look great overall. A few minor adjustments are needed in the color scheme. Let's schedule a quick call to review these changes.",senior,E003
2024-11-09 11:22:41,1,0,0,internal,2,20,"Follow-up on Task Completion","Hi Lisa, Can you update me on the status of the report you were working on? We need it for the client meeting this afternoon.",manager,E002
2024-11-09 11:50:15,8,0,0,internal,4,12,"Performance Metrics for Q3","Attached are the performance metrics for Q3. Let’s go over this during our meeting later today. Please review in advance and bring any questions you have.",senior,E006
2024-11-09 12:35:05,2,0,1,external,1,0,"Partnership Inquiry","Dear Taidot On team, I’m reaching out to explore potential partnership opportunities between our companies. Let me know a convenient time for a discussion.",external,E010
2024-11-09 13:10:28,3,0,0,internal,3,33,"Client Feedback","We received some constructive feedback from the client regarding the recent software update. I’ve summarized the key points in the attached document.",mid-level,E001
2024-11-09 13:45:55,1,1,0,external,1,0,"Invoice Clarification Needed","Hi, We noticed a discrepancy in the recent invoice. Could you please clarify the additional charges listed?",external,E012
2024-11-09 14:15:21,1,0,0,internal,1,0,"Update on CRM Outage","The CRM system issue has been resolved. You can now resume normal operations. Apologies for any inconvenience caused.",senior,E002
2024-11-09 14:50:37,6,0,0,internal,2,25,"Brainstorming Session Ideas","I wanted to share some initial ideas for the upcoming brainstorming session. Feel free to add your thoughts and suggestions to the shared document.",junior,E009
2024-11-09 15:30:12,2,1,0,internal,1,0,"Check-in with Team","Hi everyone, I just wanted to check in and see how things are going with the new process we implemented last week. Any issues so far?",manager,E005
2024-11-09 15:55:44,1,0,0,external,1,0,"Request for Proposal (RFP) Submission","Dear client, We have submitted the final version of the RFP as per your specifications. Please let us know if you need any further information.",external,E007
2024-11-09 16:20:30,4,0,0,internal,3,40,"End-of-Day Updates","Could everyone send me a brief update on their progress today? I want to ensure we're on track for the upcoming deadlines.",mid-level,E004
2024-11-09 16:45:02,1,0,0,external,2,10,"Meeting Reschedule Request","Hi Thomas, I need to reschedule our meeting from tomorrow to next Monday. Let me know if that works for you.",external,E010
2024-11-09 17:05:11,3,1,0,internal,2,22,"Well-being Initiative Feedback","Thank you to everyone who participated in the well-being initiative survey. We’re reviewing the responses and will share the action plan next week.",HR,E008
2024-11-09 17:35:28,1,0,0,internal,1,0,"Signing Off for the Day","Signing off for today. Please reach out if anything urgent comes up. See you all tomorrow!",junior,E009
2024-11-10 08:05:17,1,0,0,internal,1,0,"Morning Check-in","Good morning team! Just a quick reminder to review your priorities for the day and reach out if you need support with any tasks.",manager,E005
2024-11-10 08:45:33,2,1,0,internal,2,40,"Follow-up on CRM Fix","Hi everyone, can you confirm if you’re still experiencing any issues with the CRM after yesterday’s fix? Please respond ASAP.",senior,E002
2024-11-10 09:12:54,1,0,0,external,1,0,"Contract Renewal Confirmation","Dear Client, We’ve received your confirmation for the contract renewal. We’ll proceed with the necessary steps on our end and keep you updated.",external,E007
2024-11-10 09:30:02,3,2,0,internal,1,0,"Quarterly Review Prep","Please start gathering data for the quarterly review meeting scheduled for next Monday. We’ll need insights on project performance, client feedback, and financial metrics.",mid-level,E004
2024-11-10 09:50:10,5,0,0,internal,3,18,"New Hire Onboarding Plan","The onboarding plan for the new hires has been finalized. HR will conduct an orientation session tomorrow at 10 AM. Please welcome them to the team!",HR,E008
2024-11-10 10:15:29,2,0,1,external,1,0,"Proposal Review","Hi John, We reviewed the proposal draft you shared. The content looks solid, but we need to refine the pricing section. Can we discuss this later today?",manager,E005
2024-11-10 10:45:52,1,0,0,internal,1,0,"Coffee Break Chat","Quick reminder: Coffee break chat happening at 11 AM in the break room. Let’s take a moment to catch up and share any thoughts.",junior,E009
2024-11-10 11:05:14,4,1,0,internal,2,12,"Bug in Reporting Tool","The reporting tool is still showing incorrect data for Q3. Can someone from the tech team look into this today? It’s urgent.",senior,E002
2024-11-10 11:40:37,1,0,0,external,2,28,"Client Feedback Implementation","We’ve implemented the feedback from the client. Please let us know if further adjustments are needed before the final release.",mid-level,E001
2024-11-10 12:10:58,3,0,0,internal,1,0,"Team Building Event Update","Hi all, just a heads-up that the team-building event venue has changed due to weather conditions. New details are in the calendar invite.",HR,E008
2024-11-10 12:45:19,2,1,0,external,1,0,"Invoice Payment Confirmation","Dear Client, This is a follow-up on the outstanding invoice. Could you confirm if the payment has been processed?",external,E012
2024-11-10 13:22:15,1,0,0,internal,2,33,"Budget Review Meeting Notes","Attached are the notes from today’s budget review meeting. Please go through them and add any comments or corrections.",manager,E005
2024-11-10 13:50:26,6,0,0,internal,1,0,"Training Feedback Request","We’ve completed the new software training sessions. Please provide your feedback so we can assess what improvements are needed.",junior,E009
2024-11-10 14:05:43,2,0,1,external,1,0,"Marketing Campaign Proposal","Hi team, we have a new proposal for the upcoming marketing campaign. I’ve attached the draft for your review. Let’s discuss this in tomorrow’s meeting.",external,E010
2024-11-10 14:30:07,1,0,0,internal,1,0,"Progress Check-in","Hey everyone, just checking in on your progress with the client project updates. Let me know if you’re encountering any roadblocks.",mid-level,E004
2024-11-10 15:05:38,1,0,0,internal,3,48,"System Update Reminder","Don’t forget, the system update is scheduled for tonight at 11 PM. Save your work and log off before then to avoid any disruptions.",senior,E002
2024-11-10 15:30:21,4,2,0,internal,1,0,"Policy Update: Remote Work","We’ve made an update to our remote work policy. Please review the new guidelines and reach out if you have any questions.",HR,E008
2024-11-10 15:50:44,1,0,0,external,1,0,"Request for Additional Info","Hi Alex, We need additional information to proceed with the project. Can you provide the missing details by end of day?",external,E007
2024-11-10 16:20:32,5,0,0,internal,2,30,"Client Presentation Preparation","Reminder: The client presentation is tomorrow morning. Please ensure your slides are finalized and shared in the deck before 6 PM.",manager,E005
2024-11-10 17:00:55,2,1,0,internal,2,20,"Feedback on Policy Update","I’ve reviewed the new remote work policy and added some comments. Can we discuss this briefly during tomorrow’s check-in?",mid-level,E004
2024-11-10 17:35:13,1,0,0,internal,1,0,"End of Day Wrap-up","Signing off for today. Let’s keep the momentum going tomorrow. Great work, everyone!",junior,E009
2024-11-11 08:10:25,2,1,0,internal,1,0,"Daily Stand-up Reminder","Good morning, everyone! Just a quick reminder that our daily stand-up meeting starts at 9 AM. See you on the call.",mid-level,E004
2024-11-11 08:45:12,1,0,0,internal,2,20,"Update on Reporting Tool Bug","The bug in the reporting tool has been fixed. Please check and confirm if the data displays correctly now.",senior,E002
2024-11-11 09:15:30,4,0,0,internal,1,0,"New Policy on Meeting Efficiency","We’re implementing a new policy to streamline meetings. All meetings should now have a clear agenda and end with action items. Let’s try to keep discussions concise and productive.",manager,E005
2024-11-11 09:42:08,3,0,1,external,1,0,"Client Onboarding Session","The client onboarding session is scheduled for 2 PM today. Please be prepared to present the project plan and initial timelines.",external,E010
2024-11-11 10:05:54,1,0,0,internal,1,0,"Welcome New Hires!","Let’s all welcome the new members joining our team today! We’re excited to have you onboard and look forward to working together.",HR,E008
2024-11-11 10:35:22,2,0,0,internal,3,30,"Project Status Check-in","Can I get a quick update on the project deliverables? We’re approaching the deadline, and I want to make sure everything is on track.",mid-level,E001
2024-11-11 11:00:11,5,1,0,internal,2,15,"Lunch & Learn Session Reminder","Don’t forget about today’s Lunch & Learn session at 12 PM. We’ll be discussing best practices for remote collaboration. See you there!",junior,E009
2024-11-11 11:25:39,1,0,0,external,2,40,"Follow-up on Invoice Discrepancy","We’ve reviewed the invoice and identified the discrepancy. Please see the attached document for the revised billing statement. Let us know if you have any questions.",external,E012
2024-11-11 11:50:56,2,0,0,internal,2,22,"Q3 Report Final Draft","The final draft of the Q3 report is ready. I’ve attached it for your review. Please provide any feedback by end of day.",mid-level,E004
2024-11-11 12:20:31,3,0,0,internal,1,0,"Team Outing Poll","We’re planning a team outing for next week. Please fill out the poll to indicate your availability and preferences. Looking forward to it!",HR,E008
2024-11-11 12:45:18,1,0,0,internal,1,0,"Quick Check-in","Just checking in to see if you need any support with your tasks today. Let me know if there’s anything I can help with.",junior,E009
2024-11-11 13:10:40,6,0,0,internal,3,35,"Client Feedback Recap","Here’s a summary of the feedback we received from the client today. We need to address these points before the next meeting.",senior,E003
2024-11-11 13:35:12,1,0,0,internal,1,0,"System Maintenance Alert","Heads up: We’re conducting scheduled maintenance on the email server tonight at 11 PM. Please save any unsent drafts before then.",IT,E011
2024-11-11 14:05:26,2,1,0,external,1,0,"Confirmation of Project Scope","Dear Client, We’re confirming the updated scope of the project based on our recent discussions. Please let us know if there are any further adjustments needed.",external,E007
2024-11-11 14:25:49,1,0,0,internal,2,18,"Follow-up on Client Meeting","How did the client meeting go? Any immediate actions needed on our side?",manager,E005
2024-11-11 15:00:00,3,0,0,internal,1,0,"End of Sprint Review","Let’s wrap up the current sprint with a review session at 4 PM today. We’ll discuss what went well and what we can improve in the next sprint.",mid-level,E004
2024-11-11 15:22:38,1,0,0,external,1,0,"Inquiry About New Service Offerings","Hi Taidot On team, I’m interested in learning more about your new service offerings. Could you provide additional details or set up a call?",external,E010
2024-11-11 15:50:27,5,0,0,internal,2,20,"Data Analytics Project Update","We’ve completed the initial analysis for the data project. I’ve shared the report with you. Please review and prepare for the presentation tomorrow.",junior,E009
2024-11-11 16:10:15,1,0,0,internal,1,0,"Leave Request","I’d like to request time off next week for personal reasons. Please let me know if this needs approval or if I should submit through the system.",mid-level,E001
2024-11-11 16:30:47,2,1,0,external,1,0,"Thank You for the Meeting","Thank you for the productive meeting earlier today. We’ll start working on the action items and follow up with you next week.",external,E007
2024-11-11 17:05:36,1,0,0,internal,1,0,"End of Day Wrap-up","Signing off for today. Have a great evening everyone, and let’s continue the good work tomorrow!",junior,E009
